{
  "tx_id": "ea82c224-0f80-41cc-b877-8a7804b56c26",
  "type": "uk.gov.ons.edc.eq:feedback",
  "version": "v2",
  "data_version": "0.0.1",
  "origin": "uk.gov.ons.edc.eq",
  "flushed": false,
  "submitted_at": "2016-05-21T16:37:56.551086",
  "launch_language_code": "en",
  "submission_language_code": "en",
  "collection_exercise_sid": "9ced8dc9-f2f3-49f3-95af-2f3ca0b74ee3",
  "schema_name": "mbs_0001",
  "started_at": "2016-05-21T16:33:30.665144",
  "case_id": "a386b2de-a615-42c8-a0f4-e274f9eb28ee",
  "region_code": "GB-ENG",
  "channel": "RH",
  "survey_metadata": {
    "survey_id": "009",
    "case_ref": "1000000000000001",
    "qid": "0130000000000300",
    "BLOOD_TEST_BARCODE": "BLT11111111",
    "SWAB_TEST_BARCODE": "swT11111111",
    "PARTICIPANT_ID": "DHRF-123456789012",
    "TEST_QUESTIONS": "F",
    "COLLEX_OPEN_DATE": "08 Jan 2023",
    "COLLEX_CLOSE_DATE": "28 Jan 2023",
    "FIRST_NAME": "Vinny",
    "WINDOW_START_DATE": "2023-01-08",
    "WINDOW_CLOSE_DATE": "2023-01-28",
    "PORTAL_ID": "1234567",
    "PARTICIPANT_WINDOW_ID": "DHRF-123456789012-001"
  },
  "data": {
    "feedback_text": "Page design feedback",
    "feedback_type": "Page design and structure",
    "feedback_count": "7"
  }
}
